quelle,episode,index_string,index_binar
300_313_554_562_13,ihre falschheit hatte sie allerdings noch nicht aufgegeben ihr bruder sollte es buessen dass er sie so gestraft habe sie liess bei einem schmied ein scharfes messer machen und stellte es in das bett des koenigs als dieser abends muede sich auf das bett warf ging es ihm durch und durch und er war alsbald tot am morgen aber wie man hoerte dass der koenig ermordet waere wurde das ganze land von grosser trauer erfuellt die schwester aber hatte ihr boeses gewissen vom hof fortgetrieben und so war man ueberzeugt dass sie es getan habe die koenigin warf sich auf die leiche rang die haende und konnte nicht weinen vor schmerzdie hunde lagen um sie winselten in der trauer um ihren herrn und aechzten da erinnerten sie sich an den topf mit der lebendigmachenden salbe schnell liefen sie nach der stelle wo der drache gelegen fanden hier noch die scherben und brachten sie und es war noch so viel salbe drinnen dass man den koenig bestreichen konnte da schlug er wieder die augen auf und war gesund alles war voller jubel und niemand freute sich mehr als die koenigin als man dem koenig sagte was mit ihm vorgefallen und dass seine schwester entwichen sei rief er ja die boese schlange das hat sie getan er liess sie wieder aufsuchen und ins waldhaus einsperren bei ihrem toten kaufmann da musste sie nun fort an der leiche sitzen bis sie verhungerte,e315_a_, 
300_313_554_562_13,es geschah aber dass die hunde jetzt vor den koenig traten und sprachen von nun an koennen wir dir nichts weiter nuetzen haue uns die haeupter ab nein nie und nimmermehr das waere ein schoener dank fuer so treue dienste wenn sie ihm auch weiter keinen dienst mehr erweisen koennten so wolle er sie doch getreu pflegen bis an ihren tod da baten sie ihn aber so sehr und so lange dass er gerade den groessten dank ihnen damit erweise wenn er ihren wunsch erfuelle und so fasste er endlich betruebten herzens sein schwert und hieb jedem das haupt ab siehe da standen ploetzlich drei koenigssoehne vor ihm dank dir du hast uns erloest wir waren so lange verzaubert bis zum dank fuer geleistete dienst ein junger held uns das haupt abschlagen wuerde und das hast du getan damit zog jeder fort in seine heimat und so waren jetzt alle froh und zufrieden,e562_a_, 
300_315_undf_29,es waren einmal ein mann und eine frau die waren sehr wohlhabend und hatten nur einen sohn sie lassen diesen den beruf erlernen der ihm zusagt er hat gesagt er wolle jaeger werden darauf haben sie ihm sofort eine flinte eine doppellaeufige pistole einen dolch eine lampe und einen hund mit namen curasch gekauft der sohn ging jahraus jahrein jeden tag ueber berge und taeler zur jagd  und kam jeden abend mit wildbret nach hause er war ein ausgezeichneter jaeger eines tages ist er ueber gebirge felsen und taeler hinweg aber hat nichts erjagt mit leeren haenden wollte er nicht nach hause kommen er war das nicht gewohnt und so geht er bis spaet in die nacht ausspaehen da geht er an einem schoenen see vorbei und sieht ueber dem wasser drei schwarze punkte er zielt und gibt einen schuss ab und sieht dass nun drei tote tiere auf dem wasser waren das heisst ein fisch eine ente und ein hase er nimmt diese in seine jagdtasche und geht da begegnet er einer alten frau die sagt heut hast du eine gute jagd gemacht er tut als hoerte er nichts und sagt wenig aber die frau sagt nicht wahr du hast drei tiere mit einem schuss erlegt da die frau das so sicher sagen konnte hat er nicht umhin koennen die sache zuzugeben da sagt die frau er soll die tiere nicht durch seine eltern zubereiten lassen sondern alle drei das naechste mal mit auf diejagd nehmen so hat es derlaeger denn gehalten am abend nach dem nachtessen befiehlt der sohn seinen eltern seine tiere nicht zu beruehren und er sagt zur mutter sie brauche am andern morgen nicht aufzustehen um das fruehstueck zu bereiten er gehe anderntags nicht zur jagd das hat der mutter sehr gefallen denn sie war alt und stand nicht gern so frueh auf am folgenden morgen zur stunde da er sonst auf die jagd zu gehen pflegte hat er wieder lust bekommen zu gehen er ruft seine mutter und laesst sie das fruehstueck auftragen dann nimmt er seinen hund curasch und seine drei tiere in die tasche und geht ueber berge und taeler zurjagd den ganzen tag ueber aber hat er nichts gesehen und nichts erjagen koennen spaet am abend sieht er einen grossen und schonen vogel auf einem tannenast da er nichts erjagt hatte so will er diesen vogel schiessen er zielt aber der vogel flog von einer tanne zur andern so dass er nicht zum schuss kommen konnte und er ist so tief in den wald hineingekommen dass er weder ein noch aus wusste da steigt er auf einen baum und haelt ausschau ob er nicht irgendwo ein licht saehe da findet er wirklich weit weg ein schwaches licht,eUNDF_a_, 
300_315_undf_29,er geht diesem nach und kommt vor ein verfallenes haus er klopft an da kommt ein maedchen heraus und er fragt ob er uebernachten koenne er sei auf der jagd gewesen und wisse weder wo ein noch wo aus sie hat ihn nicht bleiben lassen wollen da hier um mitternacht zwoelf raeuber kommen die sofort merkten ob jemand hier sei oder nicht er aberhat so eindringlich gebeten dass das maedchen ihn hat eintreten lassen dann hat sie gesagt droben ist ein zimmer mit zwei betten ihr koennt dort hinaufgehen ehe die raeuber kommen ceht aber weder in das eine noch in das andere bett über jedem bett haengt naemlich ein grosses messer wie ein heumesser und wenn die raeuber menschen riechen  und sie haben eine feine nase  so ziehen sie hier an dieser schnur an der decke und jener der im bett ist wird durch das messer getoetet lch will den raeubern sagen dass ich einen bettler droben habe in einem der betten wie es schon oefter der fall war und dann ziehen sie zwar an der schnur aber sie gehen erst am andern morgen hinauf und schauen ob er etwas geld bei sich habe oder nicht der jaeger geht hinauf in jenes zimmer untersucht es und findet alles so wie es die magd gesagt hatte er nimmt seinen dolch und seine flinte und geht hin und stellt sich bei der tuer auf fuer den fall dass die raeuber kommen wurden wollte er’s mit ihnen aufnehmen um zwoelf uhr erscheinen diese tatsaechlich in der stube und sagen es rieche nach menschen die magd sagt dann sie habe einen bettler droben in einem der betten darauf ziehen sie an der schnur und derjaeger waere tot waere er im bett gewesen nachdem sie lange geplaudert und gegessen hatten wird es ganz still in der stube fruehmorgens fasst derjaeger mut die tiir seines zimmers zu oeffnen geht leise die stiege hinab und geht in die kuche da stand die magd und hatte feuer angemacht er fragt sie ob sie ihm treu sein wolle und sie war damit wohl einverstanden nun befiehlt ihr der laegen einen grossen hafen voll wasser zu sieden dann haben sie dieses wasser in kessel und eimer abgefuellt und diese neben die stubentijr gestellt wo clie raeuber drinnen am boden lagen und schliefen dann oeffnen sie die tuer und derjaeger schleudert das siedende wasser in die stube hinein ehe die raeuber zu sinnen kamen und die augen oeffnen konnten toetet er alle mit seinem dolch die einen zuerst und die andern danach dann zeigt die magd das loch wohin die raeuber die ermordeten brachten und derjaeger wirft alle dort hinunter nun will ihm die magd zu essen geben aber er sagt dass er nichts vom besitz der raeuber annehme er wolle hinaus um einen hasen zu erlegen damit sie daraus einen braten machen unterwegs begegnet er wieder der alten frau vom vorabend diese sagt heute hast du wieder eine wackerejagd gemacht hast zwoelf auf einmal erlegt aber dennoch nicht allei  o doch ich glaube ich habe alle getoetet gibt er zur antwort nein der hauptmann ist nicht getoetet worden der istdavongekommen und steht im begriff sich mit der magd zu verabreden wie sie dich toeten koennten sagt die frau dann sagt sie wenn du mit dem hasen nach hause kommst so wirst du ihn mit der magd zusammen essen darauf klagt die magd schrecklich ueber kopfschmerzen dann wirst du fragen ob sie nicht ein mittel gegen kopfschmerzen habe sie wird sagen doch sie habe schon oefter kopfweh gehabt und dann seien die raeuber hinausgegangen zu einem herrn der siebzig kuehe habe und haetten drei oder vier gemolken damit sie habe kaffee kochen koennen das habe ihr dann geholfen du musst dich sofort bereit erklaeren bei jenem herrn milch zu holen sie aber tut dergleichen als wollte sie dich zurueckhalten indem sie sagt das darf ich von euch nicht verlangen da lhr mit dem toeten der raeuber so viel muehe gehabt habt du laesst dir aber dennoch den weg zujenem herrn hinaus zeigen und gehst hin unterwegs wirst du einem baeren begegnenjener herr hat einen baeren und einen loewen die als siebzig kuehe gelten du musst schnell dem baeren deine ente hinwerfen und waehrend dieser sie fressen will nimmst du deine buechse und zielst auf den baeren dieser wird die ente fallen lassen und herbeikommen indem er mit dem schwanz wedelt wie ein gezaehmtes tier und sagt lass mich in frieden und ich will bei dir und deinem hund curasch bleibenk dann gehst du weiter und triffst einen loewen dem wirfst du den hasen hin und zielst auf ihn wie auf den baeren und dieser loewe wird das cleiche zu dir sagen wie der baer und wird mit dir kommen ohne dir ein leid zu tun vergiss aber vor allem nicht darauf dem hund den fisch zu geben sonst beginnen der loewe und der baer ein schiefes maul zu machen und schliesslich reissen sie dich darauf kehrst du zur huette der raeuber zurueck sperrst die beiden tiere in einen koben damit sie niemand sieht und sagst dann zur magd du habest den herrn mit den siebzig kuehen nicht und habest keine milch jene wird sagen es sei schon recht so die kopfschmerzen haetten nachgelassen aber sie habe jetzt einen so schweren druck aufder brust du fragst wieder was fuer mittel die raeuber gegen brustschmerzen hatten sie sagt dann diese gingen immer hinaufin eine teufelsund hexenmuehle und verlangten dort weizenmehl das half dann du musst sofort dich anerbieten weizenmehl holen zu wollen sie wird dergleichen tun als wolle sie dich nicht gehen lassen du aber nimmst deine tiere und gehst hinaufzujener muehle und klopfst an dann wird einer herauskommen und fragen was du begehrest du sagst weizenmehl dann packt der dich am rock und sagt mit dir will ich weizenmehl machen her mit dir dul darauf rufst du vorwaerts loewel vorwaerts baer vorwaerts curasch und diesewerden alle in der muehle in stuecke reissen dann gehst du zur magd zurueck und sagst du habest kein weizenmehl bekommen die wird sagen gut gut die brustschmerzen haben nachgelassen aber um mich zu befreien musst du mich mit einer geigensaite deine beiden daumen so fest zusammenbinden lassen als ich kann und dann musst du die saite allein zerreissen das musst du tun sagt die alte weiter und wenn du dann ein wenig versucht hast die saite zu zerreissen rufe die magd sie solle kommen und die saite loesen du koennest sie nicht zerreissen dann wird der raeuberhauptmann an der tuer erscheinen und seinen dolch nach dir werfen aber er wird dich nicht treffen und dann laesst du deine tiere herbeikommen und diese reissen den hauptmann in stuecke darauf gehst du in die kueche hinaus zur magd und sagst da du bloss eine solche bist will ich kurzen prozess mit dir machen und du toe dann auch sie kaum hat die alte ihre rede beendet springt ein hase an einem busch vorbei der jaeger zielt auf den hasen und trifft ihn er geht in die raeuberhuette und geht nachdem er den braten gegessen hat um die kuehe jenes herrn zu melken er vergisst aber nachdem er den baeren und den loewen bei sich hatte dem hund den fisch zu geben auf einmal machen die wilden tiere ein schiefes maul nun kommt es ihm in den sinn dem hund den fisch zu geben aber der hund lag ein stueck weit zurueck auf dem boden er reicht ihm den fisch hin der hund aber war so schwach dass er nicht nach ihm schnappte nun beginnt der jaeger den fisch in feine schnitten zu zerlegendie ereine nach der andern dem hund reichte dieser frass nun und mit jeder schnitte die er verschlang machten die tiere ein freundlicheres gesicht und schliesslich war der hund wieder genesen und alles war gut danach ging er in die hexenmuehle um das weizenmehl zu holen und hat dort alle durch seine tiere in stuecke reissen lassen und dann hat er seine daumenmit saiten zusammenbinden lassen kurz und gut als er den hauptmann und die magd getoetet hatte hat er gesehen dass viel geld und viele schaetze in diesem verfallenen haus waren,e315_a_, 
300_315_undf_29,er nimmt nichts von alledem mit sich und macht sich auf den weg zur stadt des koenigs um zu veranlassen dass die regierung diese schaetze holt er geht in ein gasthaus dieser stadt dort fragt er warum alle haeuser dieser stadt mit schwarzem flor behangen seien der wirt wundert sich dass er so fremd sei und das nicht wisse und sagt dann draussen in einer hoehle ist ein drache mit sieben koepfen und diesem muss jedes jahr eine jungfrau geopfert werden sonstverwuestet er alles der koenig hat schon sein moeglichstes getan damit jemand diesen drachen toete aber alles hat nichts gefruchtet dieses jahr hat nun das los die koenigstochter getroffen an dem und dem tag neun uhr vormittags muss sich die tochter vom drachen fressen lassen der koenig hat solchen gram dass er alle haeuser mit schwarzem trauerflor hatueberziehen lassen der jaeger hat dieser rede zugehoert hat die regierung die sache mit den schaetzen wissen lassen und ist nach hause gezogen die frauen seines dorfes flohen nach allen seiten als sie ihn mit einem loewen und einem baeren daherkommen sahen die seinen freuten sich dass er wieder zurueckgekehrt war denn sie fuerchteten er waere irgendwo zugrunde gegangen einige tage ist er zu hause geblieben und nicht auf die jagd gegangen,e300_c_anfangssituation_ankunft_und_erkundigung_der_not, 
300_315_undf_29, am tag an dem die koenigstochter vom drachen verschlungen werden sollte nimmt er seine tiere und geht in die stadt und stellt sich hinter der kapelle auf die der koenig fuer seine tochter neben der hoehle des drachen hatte errichten lassen damit sie noch beten koenne bevor sie sterbe nun kommt eine von vier pferden gezogene kutsche ganz mit schwarzem flor ausgeschlagen die tochter kommt heraus da geht der jaeger hinzu und sagt zuerst zum kutscher er wolle es mit dem drachen aufnehmen der kutscher aber hat gemeint das nuetze nichts als das die tochter des koenigs hoerte sagt sie zum jaeger sie koenne nicht verlangen dass er fuer siein den tod gehe sie sei jetzt vorbereitet und wolle schon sterben besiegen werde er den drachen ohnehin nicht dennoch hat die koenigstochter ihn schliesslich einen versuch unternehmen lassen um neun uhr waelzt der drache eine steinplatte weg und es kommt ein siebenkoepfiger drache heraus um die jungfrau zu verschlingen nun laesst der jaeger seine tiere los und die machen eins zwei drei dem drachen den garaus,e300_e_vorfeld_des_kampfes_bis_zum_sieg, 
300_315_undf_29,er schneidet allen sieben koepfen die zunge heraus nummeriert sie und nimmt sie zu sich die koenigstochter hat ihm zum dank sich selbst angeboten eraber hatte nicht sehr grosse lust und sagt er wolle noch ein jahr und drei tage sich die sache ueberlegen der jaeger geht nach hause,e300_g_nach_dem_sieg_bis_zur_trennung_des_HD_und_des_OB, 
300_315_undf_29,der kutscher kehrt mit der tochter in seiner von vier pferden gezogenen kutsche zurueck wie er ueber einer hohen bruecke gewesen ist haelt er die kutsche an und sagt zur tochter von einer gefahr bist du erloest aus dieser aber entkommst du nicht sagst du nicht dass ich den drachen getoetet habe und heira du mich nicht so werfe ich dich ueber diese bruecke in die sen tobel hinunter die tochter wusste nicht was tun lieber als in diesem tobel unten sterben wollte sie vom drachen gefressen werden schliesslich sagt sie er moege ein jahr und vier tage warten dann wolle sie ihn heiraten nun nimmt er den schwarzen flor weg und faehrt die tochter in der offenen kutsche durch die stadt knallt mit der peitsche und sagt er habe den drachen getoetet alles sagte das sei immer ein mutiger mann gewesen solches aber haetten sie nicht von ihm erwartet,e300_k_misshandlung_des_FH_bis_zur_hochzeitstag, 
300_315_undf_29,nach einem jahr und drei tagen macht sich der jaeger auf den weg zur stadt des koenigs und geht in das gleiche gasthaus wie das erste mal diesmal waren die haeuser mit rotem flor geschmueckt der wirt sagte ihm das sei so weil die koenigstochter morgen hochzeit halte mit dem kutscher der vor einem jahr den drachen getoetet habe nun wettet der jaeger mit dem wirt sein hund curasch sei imstande heute in die koenigliche kueche zu gehen und mit dreien der schmackhafen gerichte zurueckzukommen der wirt wettet um seine ganze habe der jaeger um sonst etwas nun schreibt der jaeger die gerichte auf einen zettel und steckt diesen dem hund ins maul dieser geht in des koenigs kueche die bedienten wollten ihn wegjagen aber er weicht allen aus und geht hin und springt an der koenigstochter empordie grad zuschaute wie die maegde die speisen bereiteten sie sieht den zettel im maul liest ihn und legt auf zwei teller die zwei besten hochzeitsgerichte mit diesen um den hals geht der hund schnell an allen denen vorbei die huz huz machten und kommt zum gasthaus der wirt war darob ganz ueberrascht und hat nichts anderes machen koennen als dem jaeger sein hab und gut zu ueberlassen unterdessen geht die koenigstochter zu ihrem vater und sagt ihr befreier sei der und der jaeger in dem und dem gasthausder koenig schickt einen diener zu ihm mit dem befehl der jaeger solle zu ihm kommen der aber gibt zur antwort er habe grad so weit um zum koenig zu kommen wie dieser zu ihm,e300_m_rueckkehr_des_HD_und_erkundung_ueber_die_hochzeit_bis_zum_wiedergewinn_der_aufmerksamkeit, 
300_315_undf_29,als der koenig das hoerte geht er selbst zum jaeger und ersucht ihn aufs schloss zu kommen am andern tag ist dort ein grosses fest gehalten worden anstatt einer hochzeit nach dem fest verlangt der koenig dass jeder der anwesenden sein leben erzaehle da steht der kutscher auf und sagt er sei als knabe sauhirt gewesen dann sei er von koenigs gnaden immer befoerdert worden und schliesslich kutscher geworden als kutscher sei es ihm gelungen den schrecklichen drachen zu ueberwinden wie die sieben koepfe die er da auf den tisch lege beweisen dafuer habe er die koenigstochter zur braut bekommen nun steht auch der jaeger auf und sagt er sei immer auf die jagd gegangen und habe einmal mit einem schuss drei tiere erlegt habe zwoelf raeuber getoetet dann habe er einen loewen und einen baeren ueberwaeltigt mit diesen sei er in diese stadt gekommen um die polizei wissen zu lassen wo jene getoeteten raeuber ihre schaetze haetten hier habe dann ein wirt ihm von jenem schrecklichen drachen erzaehlt und von der koenigstochter und mit hilfe seiner zwei tiere habe er den drachen getoetet er sei dann nach hause gegangen und die tochter in der kutsche zum schloss zurueck und unterwegs bei einer bruecke habe der kutscher behauptet er habe den drachen getoetet und die tochter habe sich dreinschicken muessen um nicht ueber die bruecke geworfen zu werden als er das hoerte begehrte der kutscher auf das sei nicht wahr die sieben koepfe wuerden klar beweisen dass er den drachen getoetet habe nun aber fragt der jaeger die gaeste ob sie auch schon koepfe ohne zungen gesehen haetten oeffnet das maul eines jeden kopfes und legt die zungen so hinein wie sie nummeriert waren alle haben nun dem jaeger geglaubt und der hat dann mit der tochter hochzeit gefeiert der kutscher aber ist wegen seiner luegen von vier pferden in stuecke gerissen worden,e300_o_auftritt_des_HD_vor_dem_AG_bis_zur_erkennung_seiner_heldentat, 
300_550_undf_12,es war einmal ein koenig der baute eine so schoene kirche dass weit und breit keine schoenere zu finden war da kam eines tages ein wandersmann aus weiter ferne der staunte lange ueber die schoene kirche der koenig ging zu ihm und fragte wie sie ihm gefalle der wandersmann sprach es ist die schoenste kirche die ich gesehen habe und es fehlt auch nichts darin ausser eins das ist der goldne vogel dem perlen aus dem munde fallen wenn er singt da fragte der koenig wo der zu finden waere das weiss ich nicht sprach der wandersmann ich habe aber von ihm gehoert der koenig hatte nun keine ruhe und dachte immer nur daran wie er den goldnen vogel bekommen koennte da kam der aele von seinen drei soehnen eines tages zu ihm und sagte vater ich will ausziehen und den goldnen vogel suchen der koenig war froh gab ihm das beste pferd und liess ihn ziehen er kam bald in ein gehoelz und machte sich ein feuer an da lief ein fuchs herzu und jammerte ach wie friere ich so mache dir feuer und waerme dich sprach der koenigssohn und nahm sein essen hervor der fuchs rief wieder ach wie hungert mich so suche dir was und saettige dich sprach der koenigssohn und der fuchs lief fort der koenigssohn stand auf ging weiter verzehrte all sein reisegut geriet in schlechte gesellschaft verkaufte sein ross machte schulden und verdingte sich als knecht in ein wirtshaus nach einiger zeit machte sich auch der zweite koenigssohn auf den weg den goldnen vogel zu suchen sein vater gab ihm auch ein stattliches ross und sackte ihm wohl ein es ging ihm aber grade so wie seinem aeltern bruder als er sich im walde feuer machte kam der fuchs auch und jammerte ach wie friere ich ach wie hungert mich so mache dir feuer und waerme dich so suche dir was und saettige dich sagte der koenigssohn dann zog er weiter geriet in schlechte gesellschaft brachte sich um sein geld verkaufte sein ross machte schulden und musste sich als kellner in ein wirtshaus verdingen da kam auch der juengste vor den koenig und sprach vater ich will ausziehen und den vogel suchen  wo denkst du hin wenn deine brueder nichts ausgerichtet haben wirst du am wenigsten etwas ausrichten der sohn liess aber nicht nach zu bitten und so liess ihn der koenig endlich ziehen er gab ihm aber ein schlechtes ross und nur wenig geld denn er dachte das ist ja doch alles verloren der knabe ritt fort allein sein pferd sank schon ausserhalb der stadt zusammen er ging jetzt zu fuss kam in den wald und machte sich feuer da erschien der fuchs und rief ach wie friere ich so komm und waerme dich als der junge sein essen hervor nahm jammerte der fuchs ach wie hungert mich so komme her und saettige dich sprach der junge mitleidig der fuchs kam zum feuer ass mit und schlief dann bis zum morgen neben dem jungen als dieser erwachte und fortgehen wollte sagte der fuchs deine brueder haben sich meiner nicht erbarmt und so haben sie auch den goldnen vogel nicht erwerben koennen weil du aber gegen mich so mitleidig warst will ich dir guten rat geben und beistehen gehe nur fort durch diesen wald der ist noch sieben tage lang dann kommst du auf eine grosse wiese am ende der wiese ist ein grosses schloss dort gehe hinein und du wirst sehen was du zu tun hast zuletzt gab er ihm noch eine silberne floete und sprach wenn du in der hoechsten not bist und dir nicht helfen kannst so blase darauf und ich will kommen und dir beistehen damit lief der fuchs fort in den wald der knabe aber ging weiter des weges,e550_a_, 
300_550_undf_12,nach sieben tagen kam er auf die wiese und sah das schloss er eilte nun dahin und ging getrost hinein da war eine schoene jungfrau sie weinte als sie ihn sah und sprach wie kommst du hierher mein herr ist ein sechshaeuptiger drache er wird dich umbringen  ich fuerchte mich nicht und will mit ihm kaempfen es hing aber ein grosses schwert an der wand das nahm er gleich und uebte sich damit nur einmal kam der drache und schnaubte feuer der junge schwang rasch das schwert und hieb ihm alle sechs haeupter auf einmal ab,e300_e_vorfeld_des_kampfes_bis_zum_sieg, 
300_550_undf_12,nun war die jungfrau sehr froh brachte gleich zu essen und wuenschte er solle bei ihr bleiben er aber sagte das koenne nicht geschehen er muesse den goldnen vogel suchen ob sie nicht bescheid wisse davon weiss ich nichts sprach sie gehe aber nur zu jenem schlosse hinueber da wohnt meine juengere schwester vielleicht kann die etwas sagen sie gab ihm noch einen kupfernen apfel und sprach wenn du daran drehst so fliege ich zu dir,eUNDF_a_, 
300_550_undf_12,als der junge koenigssohn zum zweiten schlosse kam war hier wieder eine schoene jungfrau und sie weinte als sie den jungen sah wehe dir mein herr ist ein neunhaeuptiger drache wenn er heimkehrt wird er dich umbringen  ich fuerchte mich nicht und will mit ihm kaempfen da nahm er das schwert das an der wand hing schwang es in der luft und uebte sich nur einmal kam der drache wie ein gewitter herbeigefahren und schnaubte feuer der junge hob sein schwert und schlug ihm auf einmal alle neun haeupter ab,e300_e_vorfeld_des_kampfes_bis_zum_sieg, 
300_550_undf_12,die jungfrau war sehr froh brachte gleich essen und wuenschte der junge koenigssohn solle immer bei ihr bleiben er aber sprach das geht nicht ich muss den goldnen vogel suchen kannst du mir sagen wo er zu finden  so gehe zu meiner juengsten schwester die wohnt dort in jenem schlosse die wird dir dazu verhelfen sie gab ihm eine silberne birne und sprach wenn du sie drehst so fliege ich zu dir,eUNDF_a_, 
