quelle,episode,index_string,index_binar
300_303_554_567_32,als hans das brieflein erhalten hatte ging er auf der stelle mit seinen drei begleitern in die koenigsburg wo es gar festlich und freudig zuging überall machte man ihm aus furcht vor den drei tieren platz und er kam bis zum saal wo der koenig seine tochter und ihr vermeintlicher retter bei der tafel sassen als hans die saaltuer oeffnete stuerzten die drei tiere wuetend auf den schaendlichen diener los und zerrissen ihn in kleine fetzen die koenigstochter eilte aber als sie den hans sah ihrem retter entgegen fuehrte ihn zu ihrem vater und erzaehlte nun wie sie durch einen eid gebunden gewesen sei den falschen diener fuer ihren retter auszugeben der koenig hatte die groesste freude gab dem hans seine hand und hiess ihn sich zu seiner rechten setzen hans setzte sich zur tafel und das fest wurde zum hochzeitsfest die drei tiere sassen auch an der tafel bekamen speise und trank und erzaehlten jetzt wie sie ihren herrn gerettet haetten da wurde nun getrunken und gezecht gesungen und musiziert bis spaet in die nacht,e300_o_auftritt_des_HD_vor_dem_AG_bis_zur_erkennung_seiner_heldentat, 
300_303_554_567_32,als sich dann hans mit seiner koeniglichen braut im schlafzimmer befand schaute er weil der mond so hell schien in den garten hinunter da sah er einen grossen schoenen rehbock der mitten in den beeten graste hans sagte zu seiner braut den muss ich haben griff nach seinem gewehr und eilte mit seinen tieren die stiege hinab und in den garten alles rufen und bitten der prinzessin er moechte doch bleiben und den rehbock rehbock sein lassen war vergebens hans sprengte ueber stock und stein dem fluechtigen rehbock nach und die tiere folgten ihm als er das schoene wild lange verfolgt hatte verschwand es ploetzlich hans sah sich in einer unwirtlichen gegend und dazu versteckte sich der mond hinter den wolken endlich erblickte hans in der ferne ein kleines licht er ging darauf zu und kam zu einer niedrigen halbzerfallenen huette darinnen fand er ein kleines altes muetterchen das zwischen vielen steinen sass und sich kaemmte als sie den stattlichen juengling mit den drei tieren sah laechelte sie und fragte hans ob sie die tiere streicheln duerfe oh vom herzen gerne sagte hans sie sind ganz heimisch und beissen nicht da langte die alte nach einem staebchen beruehrte damit die tiere  und sogleich waren sie in stein verwandelt dann verhexte sie auch den hans denn es war eine boese zauberin die in gestalt eines schoenen rehbocks viele tiere und menschen in ihre huette lockte und sie in stein verwandelte die koenigstochter wartete umsonst auf ihren gemahl und weinte und jammerte dass es einen stein haette ruehren moegen allein all ihr klagen und trauern war vergebens denn niemand konnte ihren gemahl finden da zog sie trauerkleider an und lachte nie mehr unterdessen war das jahr zu ende gegangen,e303_g_erstes_treffen_mit_dem_AN, 
300_303_554_567_32,der juengere schleifersohn hatte sich auch in der welt herumgetrieben und war ein leidenschaftlicher jaeger geworden auf seinen jagden hatte er sich auch drei tiere einen fuchs einen wolf und einen baeren zu begleitern erworben die ihm in allen gefahren beistanden er dachte oft an seinen bruder und kehrte als das jahr um war zur grossen eiche an der gabelung des weges zurueck da fand er nicht den bruder wohl aber das messer das rostig im baum stak er lenkte deshalb ohne sich lange zu besinnen auf den weg zur rechten ein und kam am zweiten tag in die stadt wo sein bruder die koenigstochter befreit hatte als die einwohner der stadt ihn und seine drei tiere sahen glaubten sie es sei der vermisste junge koenig und an allen ecken und enden wurde gejubelt der junge koenig ist wieder da alsbald war die freudenbotschaft auch ins schloss gedrungen da eilten der koenig und seine tochter ihm voll freude entgegen empfingen ihn aufs freundlichste und bestuermten ihn mit fragen wo er so lange gewesen sei der schleifersohn gab fuer jetzt ausweichende antworten und war nur darauf bedacht auf kluge weise nachrichten ueber seinen bruder einzuholen er liess sich deshalb fuer seinen bruder ansehen und behandeln und folgte der koenigstochter und ihrem vater auf das schloss dort wurde ein freudenmahl angerichtet und das wiederfinden des jungen koenigs auf festliche weise gefeiert die tafel dauerte bis spaet in die nacht dann ging man erst zu bett als der schleifersohn mit der koenigstochter im schlafzimmer war blickte er weil der mond so hell schien in den garten,e303_i_vom_erkundigung_der_not_bis_zum_aufbruch_des_HF_zum_AN, 
300_303_554_567_32,da sah er einen herrlichen rehbock in den beeten grasen sogleich erwachte in ihm die jagdlust und er sagte zur koenigstochter er muesse diesen rehbock haben sonst koennte er nicht schlafen da bat ihn die prinzessin doch zu bleiben sonst gehe es ihm wie frueher und er muesste vielleicht wieder ein ganzes jahr fortbleiben nun wusste der vermeintliche koenig genug nahm seine flinte und rief die drei tiere dann schwang er sich aufs ross und verfolgte durch dick und duenn ueber stock und stein das fluechtige tier wie er endlich nach langem jagen das wild auf schussweite erreicht hatte war es auch verschwunden und er befand sich in einer wuesten unbekannten gegend da erblickte er auch bald die huette ging auf sie zu und fand darin das alte muetterchen zwischen den sonderbaren steinen sie laechelte ihm zu aber ihm wurde ganz unheimlich zumute als er sie naeher betrachtete und sah wie sie nach ihrem staebchen langte herumtrippelte und sich den tieren naehern wollte da wurde ihm die sache klar und er rief der unholdin mit donnernder stimme zu wo ist mein bruder verfluchte hexe wenn du es mir nicht sagst hau ich dir haende und fuesse ab sie tat aber als ob sie gar nichts wuesste stellte sich sehr unschuldig und versuchte die tiere zu beruehren darob wurde der juengling zornig zog seinen hirschfaenger und hieb der alten haende und fuesse ab jetzt begann sie zu flehen und zu wimmern und gelobte alles zu gestehen sie sagte zum jaeger er solle aus dem schrank eine salbe nehmen und die steine bestreichen dann wuerde sein wunsch erfuellt werden er tat was sie geraten hatte nahm vorsichtig die salbe bestrich die steine und bald stand hans lebend mit den drei tieren vor ihm er bestrich noch die uebrigen steine und viele edle herren wurden da erloest diese fielen nun ueber die boese hexe her und toeteten sie vollends,e303_k_vom_aufbruch_zum_AN_bis_zur_seiner_ueberweltigung, 
300_303_554_567_32,die zwei brueder machten sich dann mit ihren tieren auf den weg in die stadt auf dem weg aber entspann sich ein streit wer von ihnen die prinzessin zur frau haben sollte hans glaubte das meiste recht habe er weil er sie von dem drachen befreit habe der juengere verlangte sie aber fuer die erloesung des bruders waehrend sie so stritten kamen sie zu einem fluss den sie in einem nachen uebersetzen mussten da sie aber statt des ruderns sich zankten und einander in den haaren lagen verlor der nachen das gleichgewicht und beide brueder fielen in das wasser wo sie jaemmerlich ertranken die koenigstochter wartete diesmal vergebens auf die rueckkehr ihres gemahls und wenn sie nicht gestorben ist wartet sie noch heute,e303_m_eifersucht, 
300_303_554_CoM_14,es ist einmal ein fischmeister gewesen der ist hinausgegangen an den teich um zu fischen und wie er sein netz hinunterlaesst da wirds auf einmal so schwer dass er meint es habe sich ein grosser fisch gefangen und es in die hoehe zieht da ist aber kein fisch drin sondern ein verdecktes toepfchen das koemmt ihm doch wunderlich vor und er nimmt das toepfchen heraus und den deckel ab da steigt daraus ein dicker rother nebel hervor und ehe er sichs versieht steht ein grosser allmaechtiger kerl hinter dem nebel der sagt fischmeister thu mich wieder ins toepfchen sonst gehts nicht gut aber der fischmeister sagt wie kann ich dich denn ins toepfchen hineinbringen du bist ja so gross und das toepfchen ist doch nur ganz klein doch der grosse mann sagt versuchs nur es wird schon gehen und soll dein schade nicht sein und bringst du mich hinein so sollst du nachher so viel fische fangen wie du noch nie gefangen hast und in dem netz wird auch ein kaestchen liegen das theile in sechs theile und gib einen deiner frau einen deinem pferde einen deinem hunde und die andern drei vergrab unter der dachtraufe huete dich aber dass du ehe du daheim bist ins kaestchen siehst da packte der fischmeister in den nebel und drueckte ihn mit beiden haenden nieder und wie er so recht drueckte war er auf einmal wieder im toepfchen und da nahm er schnell den deckel deckte es wieder zu und warf es ins wasser wie ihm der mann gesagt hatte als er nun aber sein netz wieder in die hoehe zog da fing er soviel fische ach soviel dass er das netz kaum heraufziehen konnte und ganz unten war auch das kaestchen drin da war er denn sehr froh und ging nach hause aber wie er so eine weile fortgegangen war konnte er seine neugierde kaum noch bezaehmen und dachte s leben wirds ja wohl nicht kosten willst einmal hineinsehen und wie er das gedacht hatte da hatte er die hand auch schon am deckel und klappte ihn auf aber wie er hineinsehen will ist er auf einmal blind da war er denn gar betruebt und tappte sich auf dem wege den er wohl hunderttausendmal gegangen gluecklich nach hause und hier erzaehlte er seiner frau alles was ihm begegnet war und wies ihm zuletzt da er gemeint recht gluecklich zu sein so gar schlimm ergangen aber wie der mann es geheissen muessen wir doch alles thun sagte er sonst moechts zuletzt noch schlimmer kommen drauf theilt er das kaestchen in sechs theile gibt einen seiner frau einen seinem pferd und einen seinem hunde die andern drei aber vergraebt er unter der dachtraufe und da geht kein jahr herum so gebaert seine frau zwei jungen die sehn sich so aehnlich dass man sie gar nicht unterscheiden kann und sein pferd bekommt zwei fohlen und der hund zwei junge und unter der dachtraufe wachsen gar zwei saebel zwei pistolen und zwei gewehre hervor und wie das alles da ist da hat auch der fischmeister sein gesicht wieder und freut sich nun recht aus herzensgrunde,eCoM_c_conceptia_magica, 
300_303_554_CoM_14,als die knaben nun aber erwachsen waren sagte der fischmeister zu ihnen immer koennt ihr nicht zu haus bleiben drum zieht hin in die weite welt und versucht euch etwas und damit gab er jedem ein pferd einen hund einen saebel ein gewehr und eine pistole und nun nahmen sie abschied von ihren aeltern und zogen davon,e303_c_eingangssituation_bis_zur_trennung, 
300_303_554_CoM_14,eine grosse strecke waren sie da schon so zusammengeritten da kamen sie in einen dichten wald und der eine sagte zum andern bruder mich hungert gar zu sehr das erste was da kommt wollen wir schiessen kaum hatte er das gesagt so kam ein baer dahergebrummt da legte er an aber der baer richtete sich auf und sagte lieber jaeger schiess mich nicht ich will dir auch zwei junge bringen da liess er sein rohr niedersinken und indem sprang auch der baer schon fort und kam sogleich mit zwei jungen baeren wieder sie zogen nun wieder weiter aber nach einer strecke sagte der erste wieder zum zweiten bruder mich hungert gar zu sehr das erste was nun kommt wollen wir schiessen wie er das gesagt hatte kam ein wolf daher da legte er seine flinte an und wollte schiessen aber indem oeffnete der wolf seinen rachen und sagte lieber jaeger schiess mich nicht ich will dir auch zwei junge bringen da sprang er fort und kam sogleich mit zwei jungen woelflein wieder und nun zogen sie weiter und die beiden baeren und die beiden woelfe folgten ihnen mit den beiden hunden hinten nach nachdem sie schon eine grosse strecke weiter geritten waren sagte der erste wieder zum zweiten bruder mich hungert gar zu sehr das erste was da kommt wollen wir schiessen da kam ein loewe daher und der aele wollte ihn schiessen aber er sagte wie der baer und der wolf lieber jaeger schiess mich nicht ich will dir auch zwei junge bringen und da lief er fort und kam sogleich mit zwei jungen loewen wieder,e554_e_leistung_des_HD_gegenueber_dem_tier_und_aussprechen_der_dankbarkeit, 
300_303_554_CoM_14,nun hatte jeder ein pferd einen hund einen baeren einen wolf und einen loewen und so ritten sie nun weiter im walde bis sie endlich an einen grossen baum kamen der grade an einem kreuzweg stand da sagte der eine zum andern lieber bruder ewig koennen wir doch nicht bei einander bleiben ich will links gehen gehe du rechts hier in diesen baum stech ich aber mein messer uebers jahr wollen wir uns hier wieder treffen ist aber einer von uns noch nicht da so wollen wir nach der klinge sehn ob sie verrostet ist dann wirds ein zeichen sein dass er todt ist darauf umarmten sie sich noch einmal und jeder zog seine strasse,e303_c_eingangssituation_bis_zur_trennung, 
300_303_554_CoM_14,der aber welcher rechts gegangen war kam bald darauf aus dem walde in eine grosse stadt da laeutete man mit allen glocken und das nahm gar kein ende und die ganze stadt war mit schwarzem tuch behangen dass es ihn gross wunder nahm was doch das alles bedeute und er den wirth in der herberge fragte ob der koenig des landes gestorben sei der wirth aber sagte ihm nicht der koenig sei gestorben aber morgen sei der tag da werde die koenigstochter an vierzehn riesen ausgeliefert damit sie von einem drachen mit vierzehn koepfen gefressen werde geschehe es nicht so werde grosses unglueck ueber das land kommen der koenig habe auch schon lange ausrufen lassen dass wer die riesen zwinge und den drachen erschlage den solle die koenigstochter haben und nach seinem tode das reich dazu aber so viele ritter es auch schon versucht sie seien alle umgekommen und morgen sei nun der tag wo die koenigstochter den riesen ausgeliefert werden solle als der jaeger das hoerte ging er am andern morgen hin zum koenig und sagte gnaedigster herr koenig ich will hinziehen und mit den riesen kaempfen seid unbesorgt um eure tochter ich werde sie schon zwingen und waeren ihrer noch einmal so viel da sagte der koenig es seien schon ganz andere vor ihm da gewesen und die haettens nicht vermocht und er moege das unnuetze blutvergiessen nicht mehr,e300_c_anfangssituation_ankunft_und_erkundigung_der_not, 
300_303_554_CoM_14,aber er bestand darauf und zog hinauf an den drachenberg und die koenigstochter fuhr in einem wagen der war schwarz behangen auch hinauf als er nun oben ankam stuerzte sogleich ein riese auf ihn los und rief ihm hohnlachend entgegen du erdwuermchen was willst du doch hier stiess ihn auch dass fast hingefallen waere aber er beraeppelte sich schnell wieder und hieb mit seinem saebel dem riesen einen arm ab und die thiere sprangen auch hinzu und warfen ihn zur erde da schlug ihm der jaeger den kopf ab und zog den berg weiter hinauf und ein anderer riese kam und auch den schlug er und so alle bis auf den vierzehnten als der am boden lag und sah dass alle die uebrigen riesen schon erschlagen waren da fiel ihm der muth in die asche und er bat den jaeger demuethig er moege ihm doch das leben schenken dann wolle er ihm auch zeigen wo der schluessel zur drachenhoehle hange da schenkte ihm der jaeger das leben und liess sich von ihm zu dem busch fuehren wo der schluessel zur drachenhoehle hing da sah er ihn denn an einem steine hangen aber vor demselben wuchs eine pflanze deren zweige hatten sich zu einem ordentlichen gitter in einander geschlungen und diese pflanze war so giftig dass wer sie nur beruehrte augenblicklich sterben musste ganz behutsam steckte er darum nur zwei finger hindurch um den schluessel herabzunehmen aber in demselben augenblick gab ihm der riese einen stoss dass er fast ein blatt beruehrt haette jedoch zog er noch eiligst den finger zurueck und griff nach seinem saebel ging auf den riesen los die thiere rissen ihn nieder und nun musste der riese selber den schluessel herausholen und als er das gethan hatte hetzte ihm der jaeger die thiere an den leib und schlug ihm den kopf ab drauf ging er zum drachenhause da sass ein altes weib vor der thuer die wollte ihn nicht heranlassen aber er schlug ihr den kopf ab und schloss auf und wie der blitz fuhr der drache heraus mit seinen vierzehn koepfen und spie feuer und flammen so dass ihm der muth fast in die asche fiel aber er rief seine thiere herbei die rissen ihn sogleich zur erde und da schlug er ihm die vierzehn koepfe ab,e300_e_vorfeld_des_kampfes_bis_zum_sieg, 
300_303_554_CoM_14,nun ging er zurueck wo die koenigstochter noch in ihrem schwarzen wagen sass und verkuendete ihr dass er die riesen und den drachen erschlagen und sie nun erloest sei da sollte er gleich mit ihr umkehren zur stadt dass hochzeit waere aber er sagte noch bin ich zu jung ich will mir erst noch ein jahr was in der welt versuchen aber dann komme ich wieder da gibt sie ihm denn zum andenken ihr tuch und er schneidet dem drachen die zungen aus wickelt sie hinein und zieht mit seinen thieren fort,e300_g_nach_dem_sieg_bis_zur_trennung_des_HD_und_des_OB, 
300_303_554_CoM_14,als die koenigstochter nun aber heimkehren will da bedroht sie der kutscher der alles von fern mit angesehen hatte und sagt er werde sie erstechen wenn sie nicht aussage dass er die riesen und den drachen erschlagen und dann muesse sie ihn heirathen da weint und jammert sie sehr aber sie kann ihn nicht erweichen und endlich verspricht sie alles zu thun damit sie nur mit dem leben davonkomme nun fahren sie heim und als sie in die stadt kommen da ist grosse freude und der koenig kommt ihnen entgegen und der kutscher erzaehlt wie er die riesen und den drachen erschlagen und so die koenigstochter erloest habe da sollte nun gleich hochzeit sein aber die koenigstochter bat ihren vater dass er ihr doch erlaube noch ein jahr zu warten die angst vor dem tode haette sie so geschwaecht sie moechte sich doch erst ein wenig wieder erholen,e300_k_misshandlung_des_FH_bis_zur_hochzeitstag, 
300_303_554_CoM_14,da gestattete es ihr der vater aber als das jahr um war grade an dem naemlichen tag da ward die hochzeit veranstaltet und alle glocken gingen wieder in der stadt und es summte vom fruehen morgen an und alle haeuser waren mit rothen teppichen behangen und ueberall war freude und jubel da kam auch der jaeger mit seinen thieren herbei und als er in die herberge kam fragte er den wirth was doch das alles bedeute der erzaehlte ihm heute sei es ein jahr da habe der kutscher des koenigs die riesen und den drachen erschlagen der die koenigstochter fressen sollen und nun habe er mit ihr hochzeit da sagte der jaeger zum wirth da muss ich auch braten von der hochzeit haben aber der wirth sah ihn ueber die achsel an und sprach da moechte ich wohl hundert thaler wetten dass ihr den nicht bekommt denn ich wuesste nicht wie ihrs anfangen wolltet aber der jaeger sagte gilt die wette  ja sagte der wirth da schickt er seinen baer hin zum palast des koenigs der laeuft die kreuz und quer und rennt hier gegen eine frau da gegen einen mann aber endlich kommt er doch ins schloss stellt sich hinter den stuhl der koenigstochter und faengt an ganz leise zu brummen da sieht sie sich um und erkennt mit freuden den baeren ihres jaegers nun geht sie mit ihm hinaus in ihre kammer und fragt ihn was er begehre der baer erzaehlt ihr sein herr sei in die stadt gekommen und wuensche braten von der tafel des koenigs zu haben sogleich befiehlt sie dem koch dass er dem baeren eine ganze schuessel voll herbringe und damit geht der baer lustig brummend von dannen und zurueck ins wirthshaus nun sagt der jaeger herr wirth die wette habt ihr verloren aber ich will auch noch kuchen wie ihn der koenig selber isst haben nein sagt der wirth das koennt ihr nicht da setze ich mein ganzes haus gegen gut sagt der jaeger und schickt den wolf hin ins schloss der laeuft ohne viel besinnen grade aus und wie ihn die schildwacht am eingang zurueckhalten will da rennt er sie ueber den haufen und springt die treppen hinaufhier wird die koenigstochter sogleich seiner ansichtig und fragt ihn was sein begehren sei da sagt er ihr der jaeger wuensche von dem kuchen zu haben den der koenig selber esse wie er aber so mit ihr spricht wird ihn der koenig gewahr und fragt seine tochter was das thier hier wolle da erzaehlt sie ihrem vater sein anliegen und der befiehlt dass sogleich einer hingehn solle und den jaeger selber holen,e300_m_rueckkehr_des_HD_und_erkundung_ueber_die_hochzeit_bis_zum_wiedergewinn_der_aufmerksamkeit, 
300_303_554_CoM_14,als der nun kommt wird er gar freundlich von dem koenig empfangen denn so hatte es ihm die tochter gerathen und musste sich obenan an die tafel dicht neben den koenig setzen da assen sie nun und tranken und als zuletzt auch die drachenkoepfe auf den tisch gesetzt wurden sagte der jaeger das sind ja graeuliche thiere ob die auch wohl zungen haben ja wohl sagte der koenig zungen muessen sie auch haben denn womit sollten sie sonst das feuer ausspeien nein sagte der kutscher zungen haben sie nicht da holt der jaeger das tuch heraus welches ihm die prinzessin zum andenken gegeben und daraus die zungen der vierzehn drachenkoepfe hervor oeffnete die rachen und legte sie hinein und sie passten alle ganz genau als das der kutscher sah fiel er ohnmaechtig um und wurde hinausgetragen der jaeger aber hielt nun hochzeit mit der koenigstochter und als die vorueber war wurde der kutscher in ein mit eisernen naegeln ausgeschlagenes fass geworfen und einen steilen berg hinuntergerollt,e300_o_auftritt_des_HD_vor_dem_AG_bis_zur_erkennung_seiner_heldentat, 
300_303_554_CoM_14,einige tage drauf steht der jaeger einmal in der nacht auf da sieht er aus seinem fenster in dem nahen walde ein feuer brennen und da wird er so neugierig dass er mit seinen thieren hinauszieht um zu sehen was es sei eine weite strecke ist er schon fort da findet er ein altes weib an einem feuer die ruft immer deine thiere thun mir was deine thiere thun mir was aber er sagt ihr sie solle nicht fuerchten seine thiere wuerden ihr kein haerchen kruemmen sie jedoch gibt ihm eine ruthe und bittet ihn dass er seine thiere damit schlagen moege damit sie ihr nicht zu nahe kaemen da thut ers auch aber im selben augenblick sind auch die thiere schon in stein verwandelt und ihn selbst schlaegt die alte ebenfalls da ist er auch eine steinerne bildsaeule als nun der gemahl der koenigstochter gar nicht wiederkam war grosse trauer im schlosse und in der ganzen stadt und es wurde wieder mit allen glocken gelaeutet und alle haeuser wurden mit schwarzem tuch ausgeschlagen und die koenigstochter weinte tag und nacht,e303_g_erstes_treffen_mit_dem_AN, 
300_303_554_CoM_14,um dieselbe zeit nun war aber der andre bruder wieder an den grossen baum im walde gekommen und hatte gesehn dass das messer auf der seite nach welcher sein bruder hingezogen schon halb verrostet war da fuerchtete er dass ihm ein grosses unglueck wiederfahren sei und zog nach derselben richtung fort die sein bruder genommen da kam er denn auch in die stadt und als er mit seinen thieren ins thor trat war sogleich grosse freude und er musste mit aufs schloss wo ihm die prinzessin um den hals fiel und sagte wie freue ich mich dass du wieder da bist ich glaubte du seiest verunglueckt und wuerdest nimmer wiederkehren da merkte er denn wohl dass hier eine verwechslung stattfinde und er fuer seinen bruder gehalten werde aber er liess alles ruhig geschehn weil er dachte vielleicht dass du da so erfaehrst wohin er gegangen und ihn noch retten kannst als es aber abends zum schlafengehen kommt da legt er sich zu der prinzessin ins bett aber zwischen sich und sie legt er seinen saebel und darueber noch kreuzweis seine pistolen darueber verwundert sich die prinzessin sehr und wird ganz traurig nach einer weile jedoch wird sie still und schlaeft ein,e303_i_vom_erkundigung_der_not_bis_zum_aufbruch_des_HF_zum_AN, 
300_303_554_CoM_14,in der nacht aber laesst es dem zweiten bruder gar keine ruhe und er steht auf und tritt ans fenster da sieht er auch wie der erste das feuer brennen zieht mit seinen thieren hinaus und trifft die alte die sagt zu ihm deine thiere thun mir was deine thiere thun mir was und will ihm eine ruthe geben dass er sie anschlage aber er hat am wege die versteinerten thiere stehn sehen zieht sogleich seinen saebel und sagt warte du verfluchte hexe du hast gewiss meinen lieben bruder todt gemacht und damit will er ihr den kopf abhauen da faellt sie ihm zu fuessen und bittet himmelhoch er moege ihr doch das leben schenken sein bruder solle ja auch sogleich wieder lebendig sein da thut ers und nun gibt sie ihm eine flasche und sagt ihm daraus solle er ein paar tropfen auf die steine giessen das thut er und sogleich sind sein bruder und die thiere wieder lebendig da umarmten sie sich beide und freuten sich so recht sehr dass sie einander wiedersahen der eine aber sagte zum andern die alte boese hexe duerfen wir nicht leben lassen dass sie nicht noch mehr unglueck anrichte und sogleich packte er sie und warf sie ins feuer aber obgleich sie mitten in demselben lag blieb sie doch unversehrt und da merkten sie denn wohl dass sie irgend einen zauber bei sich tragen muesse holten sie noch einmal heraus und rissen ihr die kleider vom leibe und als sie ihr die kappe vom kopfe zogen da flog der teufel drunter hervor sogleich warfen sie sie wieder ins feuer und nun brannte sie lichterloh,e303_k_vom_aufbruch_zum_AN_bis_zur_seiner_ueberweltigung, 
